,index,year,month,day,publishedAt,headline,summary,source,API
79,48,2025,1,8,2025-01-08 19:20:43,"Evercore ISI Raises Tesla (TSLA) Price Target, Cites Trump Presidency Benefits","We recently published a list of Top 10 AI Stocks on Wall Street’s Radar. In this article, we are going to take a look at where Tesla, Inc. (NASDAQ:TSLA) stands against other AI stocks on Wall Street’s Radar. As reported by Reuters, Wall Street’s main indexes rose on Monday to more than one-week highs, driven […]",Yahoo,finnhub_news
80,49,2025,1,8,2025-01-08 19:08:00,8 Tech Stocks for Another AI-Driven Year,"Just a few trading days in, and it already looks like another tech-driven year, with artificial intelligence once again at the forefront.  New Street Research has eight tech picks to start 2025.  As of Tuesday’s close the S&P 500 was up 0.5% since the start of the year, while the Nasdaq Composite has climbed 0.9%.",Yahoo,finnhub_news
81,51,2025,1,8,2025-01-08 18:34:59,Nvidia could become the 'platform for robotics': Analyst,"Nvidia (NVDA) CEO Jensen Huang unveiled the company's latest product innovations at the 2025 Consumer Electronics Show (CES), including self-driving cars and humanoid robots. Bob O'Donnell, president and chief analyst of TECHnalysis Research, LLC, joins Catalysts to discuss this development. O'Donnell characterizes Nvidia's entry into robotics as ""a long-term play,"" noting that ""it won't happen overnight."" He references Nvidia's early involvement in autonomous vehicles, stating, ""frankly they were a little too early,"" but suggests their head start with such technology means ""now they're coming in much more strongly."" Highlighting Nvidia's ""Cosmos"" release, an artificial intelligence (AI) software platform that ""allows you to do gen AI for physical actions."" In other words, users can train robots, autonomous vehicles, and other devices ""to react and do analog things in the physical world."" He emphasizes its significance, adding, ""That's been a huge stopping point for robotics, and that's why it's a big deal and will have a payoff."" Drawing a parallel to other tech giants, O'Donnell tells Yahoo Finance, ""We think about Microsoft (MSFT) on the Windows side, and we think about Google (GOOG) and Apple (AAPL) on the mobile phone side, and maybe Nvidia becomes sort of the platform for robotics."" To watch more expert insights and analysis on the latest market action, check out more Catalysts here. This post was written by Angel Smith",Yahoo,finnhub_news
82,52,2025,1,8,2025-01-08 18:23:00,Tesla CEO Elon Musk has renewed the fight for his $56 billion pay package,Tesla (TSLA) CEO Elon Musk on Wednesday officially filed an appeal with Delaware’s Supreme Court after a state judge rejected his $56 billion compensation package for the second time.,Yahoo,finnhub_news
83,53,2025,1,8,2025-01-08 17:57:35,"Tesla, eBay on Facebook, bitcoin falling: Market Minute","Yahoo Finance host Rachelle Akuffo examines several of the top trending stocks as part of this morning's Market Minute. Tesla (TSLA) could receive $1 billion from rival EV makers that need aid in meeting carbon emission standards in the European Union (EU). Meta Platforms (META) is testing out eBay (EBAY) listings on Facebook in select regions. Bitcoin (BTC-USD) falls below $95,000 on Wednesday with some Wall Street experts anticipating an even bigger drop in the cryptocurrency's price. To watch more expert insights and analysis on the latest market action, check out more Wealth here. This post was written by Luke Carberry Mogan.",Yahoo,finnhub_news
84,54,2025,1,8,2025-01-08 17:45:54,"'Physical AI': An All-Robotics Portfolio Sleeve, Preparing For 'Thor'",Nvidia's CEO highlights robotics advancements at CES. Learn why our rankings of top robotics and AI stocks include both blue chips and small-cap growth stories.,SeekingAlpha,finnhub_news
85,55,2025,1,8,2025-01-08 17:31:18,Elon Musk's Trump Connection: Hyundai CEO Sees Positive Industry Impact,"Hyundai Chief Dismisses Fears Over Musk's Trump Ties, Sees Industry Upside",Yahoo,finnhub_news
86,57,2025,1,8,2025-01-08 16:15:00,Tesla Stock Is Wobbling. What to Know About Its Latest Moves.,The National Highway Traffic Safety Administration has started looking into the EV maker's new feature.,Yahoo,finnhub_news
87,58,2025,1,8,2025-01-08 15:36:02,Tesla Poised for $1 Billion Windfall From EU’s Emissions Curbs,"(Bloomberg) -- Tesla Inc. could collect more than €1 billion ($1 billion) in compensation from rival automakers that need help meeting tougher pollution standards in the European Union this year, UBS Group AG analysts said.Most Read from BloombergNYC’s Subway Violence Deters Drive to Bring Workers Back to OfficeDutch Central Bank Restores Amsterdam’s ‘Ugliest Building’Can American Drivers Learn to Love Roundabouts?NYC Condo Owners May Bear Costs of Landmark Green Building LawCan States Hit the B",Yahoo,finnhub_news
88,59,2025,1,8,2025-01-08 14:56:56,Sell Tesla: It's Time To Let Others Continue Speculating,"Tesla's AI business drives 70% of its valuation, raising concerns. See why TSLA stock is overvalued and carries significant risks for investors.",SeekingAlpha,finnhub_news
89,60,2025,1,8,2025-01-08 14:55:52,Stock Market Today: Dow Jones Slips Ahead Of Fed Minutes; Nvidia Tests Key Level As Tesla Rises (Live Coverage),Stock Market Today: Dow Jones Slips Ahead Of Fed Minutes; Nvidia Tests Key Level As Tesla Rises (Live Coverage),DowJones,finnhub_news
90,61,2025,1,8,2025-01-08 14:31:57,Key investment themes to watch in 2025,"As 2025 gets into full swing, it's important to consider the key themes likely to drive market movements throughout the year.",Yahoo,finnhub_news
91,62,2025,1,8,2025-01-08 13:53:00,"These Stocks Are Moving the Most Today: Nvidia, AMD, Palantir, IonQ, Moderna, Vir, Edison International, Constellation Energy, and More","These Stocks Are Moving the Most Today: Nvidia, AMD, Palantir, IonQ, Moderna, Vir, Edison International, Constellation Energy, and More",MarketWatch,finnhub_news
92,63,2025,1,8,2025-01-08 13:30:42,"Magnificent Seven Stocks: Nvidia, Tesla Slide; Meta Sells Off","Magnificent Seven Stocks: Nvidia, Tesla Slide; Meta Sells Off",DowJones,finnhub_news
93,64,2025,1,8,2025-01-08 13:22:42,FSD And AI May Not Add To Tesla’s (TSLA) Topline In 2025,"Elon Musk has claimed that Tesla’s future is now associated with its AI ventures, not necessarily car delivery numbers. Tesla has always been more than just a car company, so nothing surprising in Musk’s point of view. The company’s energy division reported a revenue growth of 100%, adding $10 billion to its topline. BYD is […]",Yahoo,finnhub_news
94,65,2025,1,8,2025-01-08 13:00:00,"Prediction: This Artificial Intelligence (AI) Company Will Join Nvidia, Alphabet, Tesla, Amazon, Apple, and Broadcom as the Next Trillion-Dollar Stock-Split Stock","Among these companies, Apple, Nvidia, Alphabet, Amazon, Tesla, and Broadcom completed stock splits in recent years.  Besides each of these companies playing a pioneering role in the artificial intelligence (AI) revolution, each had big run-ups in their respective share prices before splitting their stocks.",Yahoo,finnhub_news
95,66,2025,1,8,2025-01-08 12:05:00,"Down 18% From All-Time Highs, Is the Trump Joyride Over for Tesla?",Tesla stock is down 19% from all-time high prices seen just a few weeks ago.,Yahoo,finnhub_news
96,56,2025,1,8,2025-01-08 11:30:00,Musk Vaulted to the Top of a Popular Videogame. Everyone’s Asking Where He Found the Time.,"The head of six companies says he recently became one of the world’s top ‘Diablo IV’ players, a milestone gamers say would have required playing ‘all day, every day’",Yahoo,finnhub_news
97,50,2025,1,8,2025-01-08 11:08:00,"These Stocks Are Moving the Most Today: Nvidia, Palantir, Tesla, Rigetti Computing, Moderna, Cal-Maine, and More","Nvdia shares claw back some losses from the previous session, Palantir stock extends declines, and quantum-computing stocks fall sharply following comments from Nvidia’s CEO.",Yahoo,finnhub_news
98,67,2025,1,8,2025-01-08 11:00:00,Most big cryptocurrencies fall as Avalanche declines,Most big cryptocurrencies fall as Avalanche declines,MarketWatch,finnhub_news
99,68,2025,1,8,2025-01-08 11:00:00,Most of the ‘Sweet 16’ stocks have dominated. They might do it again in 2025.,Most of the ‘Sweet 16’ stocks have dominated. They might do it again in 2025.,MarketWatch,finnhub_news
100,69,2025,1,8,2025-01-08 10:57:47,"Dow Jones Falls On Surprise Jobs Data, Fed Minutes Next; Nvidia Rebounds From Key Level","Dow Jones Falls On Surprise Jobs Data, Fed Minutes Next; Nvidia Rebounds From Key Level",DowJones,finnhub_news
101,70,2025,1,8,2025-01-08 10:00:00,Latest Memo From Howard Marks: On Bubble Watch,,SeekingAlpha,finnhub_news
102,71,2025,1,8,2025-01-08 09:35:11,ARKK: Tesla Overweighting Now Paying Off,ARK Innovation ETF's strategic overweighting of Tesla and Coinbase has driven a significant performance rebound. Click here to find out why I rate ARKK a buy.,SeekingAlpha,finnhub_news
103,72,2025,1,8,2025-01-08 09:10:19,"Dow Jones Futures Fall; What To Do After Nvidia, Palantir Lead Stock Market Sell-Off","Dow Jones Futures Fall; What To Do After Nvidia, Palantir Lead Stock Market Sell-Off",DowJones,finnhub_news
104,73,2025,1,8,2025-01-08 09:00:47,"Investors Can't Quit Nvidia, Tesla And Huge Bitcoin Holder, Schwab Says","Investors Can't Quit Nvidia, Tesla And Huge Bitcoin Holder, Schwab Says",DowJones,finnhub_news
105,74,2025,1,8,2025-01-08 07:46:13,"Edmunds: The best used all-wheel-drive cars you can get for under $25,000","All-wheel drive might not be a must-have, but it sure is nice to have if you live in any of the large swaths of America that regularly see snow. Certainly a good set of winter tires will get the job...",Finnhub,finnhub_news
106,75,2025,1,8,2025-01-08 07:00:00,Tesla and Nvidia dominated the stock market last year. Why more pedestrian names can shine in 2025.,Tesla and Nvidia dominated the stock market last year. Why more pedestrian names can shine in 2025.,MarketWatch,finnhub_news
107,76,2025,1,8,2025-01-08 05:55:00,LRT Capital Management December 2024 Investor Update,LRT Global Opportunities is a systematic long/ short strategy that seeks to generate positive returns. Read more here.,SeekingAlpha,finnhub_news
108,77,2025,1,8,2025-01-08 05:20:00,HORAN Capital Advisors Winter 2024 Quarterly Investor Letter,"With Q4 2024 behind investors, some of the uncertainty that served as a potential headwind for the market is now in the rearview mirror. Click here to read more.",SeekingAlpha,finnhub_news
109,78,2025,1,8,2025-01-08 04:42:00,2024 Performance Review And Future Strategy,"My 2024 picks outperformed the S&P 500, mainly due to Tesla, but small biotech firms lagged significantly. Learn more about my 2024 performance here.",SeekingAlpha,finnhub_news
110,79,2025,1,8,2025-01-08 03:03:00,"Analysts mixed on Tesla after sales results, Full Self-Driving","Also, Rivian announced it solved a major setback.",Yahoo,finnhub_news
111,81,2025,1,8,2025-01-08 00:00:19,How Washington's tag on China's CATL could affect Tesla,"Washington's addition of CATL to a list of firms it says work with China's military could put Tesla founder Elon Musk in a tight spot, challenging how he balances his role in the Trump administration with his ties to China.  CATL, the world's largest battery maker, is a major supplier of lithium iron phosphate (LFP) batteries to Tesla for its Shanghai factory, the U.S. automaker's largest.  Tesla has been exporting these cars equipped with CATL batteries to other markets such as Europe and Canada.",Yahoo,finnhub_news
112,74,2025,1,8,2025-01-08 00:00:00,Porsche reprend la meilleure idée de Tesla pour ses batteries de voitures électriques,"Quelques semaines après sa montée au capital au sein de l'entreprise Varta, Porsche va désormais bénéficier de cellules cylindriques pour ses futures voitures électriques et hybrides. Voici ce que cela va changer concrètement.",Frandroid,api_news_org
113,8,2025,1,8,2025-01-08 00:00:00,Watch Tesla rival BYD's electric supercar 'jump' over a pothole at speed,"The Tesla rival launched its first supercar, the Yangwang U9, last year, and has shown off its ability to ""jump"" over potholes and road spikes.",Business Insider,api_news_org
114,21,2025,1,8,2025-01-08 00:00:00,Police Say Suspect in Tesla Explosion Outside Trump Hotel Used AI to Help Plan Attack,Sheriff of the Las Vegas Metropolitan Police Department called the use of generative AI a “game-changer” and “a concerning moment” and said the department was sharing information with other law enforcement agencies.,Time,api_news_org
115,51,2025,1,8,2025-01-08 00:00:00,Crashs à répétition : Tesla épinglée par les autorités américaines,"L’avenir de la conduite ? Apparemment, il inclut beaucoup de tôles froissées.",Presse-citron,api_news_org
116,84,2025,1,8,2025-01-08 00:00:00,Réparer soi-même une Tesla devient plus simple grâce à ce nouveau catalogue officiel,"S'il était assez compliqué d'acheter des pièces officielles Tesla par soi-même, sans passer par un revendeur agréé, ce sera bientôt plus facile via un immense catalogue de pièces détachées en ligne proposé par la marque. Ce même catalogue vient par ailleurs d…",Frandroid,api_news_org
117,88,2025,1,8,2025-01-08 00:00:00,"Tesla trébuche, mais reste numéro 1 mondial de la voiture électrique avec un écart infime sur BYD","Avec plus de 1,7 million de voitures électriques vendues en 2024, Tesla conserve sa place de leader mondial. Mais si la firme américaine dépasse toujours son rival chinois BYD, elle affiche pour la première fois de son histoire des ventes en baisse par rappor…",Frandroid,api_news_org
118,89,2025,1,8,2025-01-08 00:00:00,Skoda améliore sa voiture électrique rivale du Tesla Model Y et tutoie désormais les 600 km d’autonomie,"Cinq ans après son lancement, le Skoda Enyaq se refait une petite beauté. Face à une concurrence de plus en plus rude, y compris en interne, cette voiture électrique soigne son look et son aérodynamisme, de quoi venir titiller les 600 km d'autonomie. Voici ce…",Frandroid,api_news_org
119,82,2025,1,7,2025-01-07 23:49:38,Why Nvidia (NVDA) Is Poised to Lead the Robotics Industry,"Nvidia stock (NVDA) reached new heights in 2024, buoyed by demand for its artificial intelligence (AI)-enabling graphics processing units (GPUs). With a commanding share in the AI accelerator market, some analysts argue that any upside is already priced in. However, investors should consider Nvidia’s position in disruptive technologies, notably robotics. I’m still bullish on Nvidia due to its strong cash reserves, technological lead, and opportunities to dominate in new sectors. Nvidia’s Robot W",Yahoo,finnhub_news
120,83,2025,1,7,2025-01-07 23:10:28,How Uber fits into the AI landscape,"Wedbush Securities added Uber (UBER) to its 'best ideas' list, highlighting the company's role in the autonomous vehicles (AV) industry. Scott Devitt, Wedbush Securities managing director of equity research, appears on Market Domination to discuss Uber's new partnership with Nvidia (NVDA) and its role in the larger AV landscape. ""Uber supports the autonomous industry by providing distribution,"" Devitt shares. ""It's comforting to think that Uber may be well positioned when we get to fully autonomous, but that's probably the greatest risk to its business model as well."" Devitt also discusses the dynamics between Waymo, Tesla (TSLA), and Uber and how these relationships may play out in the future. To watch more expert insights and analysis on the latest market action, check out more Market Domination here. This post was written by Josh Lynch",Yahoo,finnhub_news
121,84,2025,1,7,2025-01-07 23:02:21,"Why Tesla, Broadcom, and Rivian Fell Today as Treasury Yields Shot Higher","Treasury yields continued to surge on sticky inflation data, dragging the market down today.  Tech and artificial intelligence (AI) stocks bore the brunt of the sell-off, as the Nasdaq Composite fell nearly 2%, more than the other major market indexes.  Shares of electric vehicle makers Tesla (NASDAQ: TSLA) and Rivian Automotive (NASDAQ: RIVN) fell roughly 4% and 5%, respectively.",Yahoo,finnhub_news
122,85,2025,1,7,2025-01-07 23:00:29,"Tesla Slides as Regulators Investigate Crashes, Bank of America Downgrades Stock",Tesla shares dropped Tuesday as federal regulators said they’re looking into crashes related to the company's automated vehicle summoning features and analysts at Bank of America downgraded the stock.,Yahoo,finnhub_news
123,86,2025,1,7,2025-01-07 22:40:40,"Las Vegas Cybertruck suspect used ChatGPT to plan blast, police say","The suspected driver of the Tesla Cybertruck that exploded outside the Trump International Hotel in Las Vegas on New Year's Day used popular chatbot ChatGPT to plan the blast, officials told reporters...",Finnhub,finnhub_news
124,87,2025,1,7,2025-01-07 22:05:21,Here’s What Tesla (TSLA) Can Do To Revive Delivery Numbers,"Many market participants believe Tesla is overextended. They blame it on the elections and Elon Musk’s political activities. But few realize that from the middle of April to just before the elections, the stock had already run up 75%! The Tesla rally didn’t start after Trump’s victory, it had begun 6 months earlier. The stock […]",Yahoo,finnhub_news
125,88,2025,1,7,2025-01-07 21:59:00,"Tesla Stock Is Down. Wall Street, Not an NHTSA Investigation, Is the Reason.","BofA Securities analyst John Murphy downgraded shares of electric-vehicle maker Tesla to Hold, but his new target price implies about 17% upside.",Yahoo,finnhub_news
126,89,2025,1,7,2025-01-07 21:29:59,"Bank of America downgrades Tesla stock, raises price target saying 'execution risk is high'","Tesla stock slipped on Tuesday after Bank of America said it sees shares fairly priced, with some risk to the downside.",Yahoo,finnhub_news
127,90,2025,1,7,2025-01-07 20:37:08,Uber and Lyft Adapt Robotaxi Strategy to Compete in Tesla and Waymo's Space,"Uber Technologies Inc (NYSE:UBER) and Lyft Inc (NASDAQ:LYFT) have bounced back on their robotaxi ambitions, albeit with a twist. The ride-hailing giants restructured their businesses to accommodate competitors who have cracked the code, the Wall Street Journal reports. Under their new strategy, Uber and Lyft will gain a percentage of driverless taxi bookings while taking charge of maintaining the fleet. Also Read: Trump Administration to Challenge Social Media Censorship, Setting Stage for Confl",Yahoo,finnhub_news
128,91,2025,1,7,2025-01-07 20:06:40,"3 stocks to gain under Trump 2.0: Tesla, Amazon, Palantir","Rational Equity Armor Fund portfolio manager Joe Tigay joins Seana Smith and Madison Mills on Catalysts to outline his three stock picks that could gain under Trump's second term in the White House: Tesla (TSLA), Amazon (AMZN), and Palantir (PLTR). Tigay notes that Tesla is a leader in the world of electric vehicles (EVs) and is likely to receive favorable treatment from the new presidential administration. This may be bolstered by the fact that reduced EV spending overall is anticipated under Trump 2.0, positioning Tesla to be the winner of the sector. Beyond Tesla's EVs, Tigay highlights the company's battery sector as a promising revenue stream in the future. ""I think that's going to be a big player going forward in the next four years,"" he says. , among other signs that Bezos has been fostering an amicable relationship with the president-elect. These moves note a shift from the historical feud between Bezos and Trump.Amazon is another one of Tigay's top picks, partly due to Jeff Bezos' recent financial support of Trumphttps://finance.yahoo.com... ""It seems like Amazon, this time around, is attempting to be on more favorable conditions,"" Tigay explains. ""In general, Amazon wants to have a favorable relationship with this administration because there's big money to be had, specifically in the cloud services."" He adds that Amazon may be better positioned for upcoming tariffs and expected tax reductions. Tigay's third top pick is Palantir, which he describes as ""the software innovation of the AI world."" The company had a significant run-up after the election, receives a lot of government business, and has the right products to ""put AI to work."" To watch more expert insights and analysis on the latest market action, check out more Catalysts here. This post was written by Naomi Buchanan.",Yahoo,finnhub_news
129,92,2025,1,7,2025-01-07 19:44:40,Meta ends fact-checking in shift closer to Musk's X and Trump,"In explaining the decision, Meta CEO Mark Zuckerberg nodded to a ""cultural tipping point"" after Trump's election.",Yahoo,finnhub_news
130,93,2025,1,7,2025-01-07 19:32:26,"Tesla (TSLA) Stock Slides on New Probe, Downgrade","Tesla (TSLA) stock is retreating 4% today after the federal government announced a new probe of the firm. Additionally, Bank of America downgraded the shares to Neutral from Buy today. Another Investigation of Tesla The federal government’s National Highway Traffic Safety Administration (NHTSA), which has already been conducting multiple probes of Tesla, disclosed today that […]",Yahoo,finnhub_news
131,94,2025,1,7,2025-01-07 19:21:07,'Complacency' could be the biggest risk to investors in 2025,"Allspring Global Investments senior portfolio manager Bryant VanCronkhite joins Brad Smith on Wealth to discuss his top investment outlooks and share the biggest market risks for 2025. VanCronkhite warns of investor ""complacency"" in 2025, particularly regarding the Magnificent Seven tech stocks. While acknowledging their ""tremendous"" returns, he cautions, ""That's a risk because the market is broadening out right now."" He explains, ""We don't want to pay as much of a multiple for companies that are growing slower, which is the Mag Seven, compared to the broader market, which is the Russell 2000 (^RUT) and the Russell mid-cap stocks."" VanCronkhite advises investors to be strategic. ""That doesn't mean sell it; it doesn't mean leave. Just be careful about staying too long. Rotate down,"" he tells Yahoo Finance. Regarding sector opportunities, VanCronkhite expresses caution about the banking sector, describing it as ""nerve-racking"" despite market optimism. Instead, he points to materials and healthcare as sectors with attractive valuations that could outperform in 2025. To watch more expert insights and analysis on the latest market action, check out more Wealth here. This post was written by Angel Smith",Yahoo,finnhub_news
132,95,2025,1,7,2025-01-07 19:18:11,Tesla's Self-Driving Tech Under Fire: Safety Concerns and Legal Challenges Cloud Future Potential,"Tesla's autonomy efforts show promise, but safety and regulatory hurdles remain significant obstacles for the company",Yahoo,finnhub_news
133,96,2025,1,7,2025-01-07 19:12:52,AMC Short-Selling Spikes; Are Meme Stocks A Buy Now?,"Meme stocks like AMC Entertainment and GameStop get their price spikes from strong buying interest.  Shares of AMC have been trading along the 50-day moving average for weeks now, with the stock basically going sideways since May.  It is better to bring a time-tested method for stock picking and search for buy points in proper bases.",Yahoo,finnhub_news
134,97,2025,1,7,2025-01-07 19:09:56,Outlook on the AI Sector in 2025,"-- Jon McNeill, Former Tesla President, Vistashares Co-Founder speaks to Romaine Bostick and Scarlet Fu about Vistashares launching ETF and the AI sector outlook in 2025....",Finnhub,finnhub_news
135,98,2025,1,7,2025-01-07 18:54:40,"Elon Musk has expressed interest in buying English soccer club Liverpool, his father says","Elon Musk's father says his billionaire son has expressed interest in buying English soccer club Liverpool.  The Premier League club is privately owned by Fenway Sports Group, which has not indicated it wants to sell but has accepted external investment in the past.  Errol Musk, in an interview with Times Radio, acknowledged that the Tesla CEO has shown an interest in the six-time European Cup champions.",Yahoo,finnhub_news
136,99,2025,1,7,2025-01-07 18:31:42,Tesla Faces Probe Over Crash Allegations in Vehicles With Driverless Feature,"Tesla (TSLA) faces an investigation involving about 2.59 million vehicles with ""Actually Smart Summo",Yahoo,finnhub_news
137,100,2025,1,7,2025-01-07 17:33:00,"These Stocks Moved the Most Today: Nvidia, Micron, Aurora Innovation, Tesla, Carvana, Moderna, Palantir, and More","These Stocks Moved the Most Today: Nvidia, Micron, Aurora Innovation, Tesla, Carvana, Moderna, Palantir, and More",MarketWatch,finnhub_news
138,101,2025,1,7,2025-01-07 17:32:26,"Man who exploded Tesla Cybertruck outside Trump hotel in Las Vegas used generative AI, police say","LAS VEGAS — The highly decorated soldier who exploded a Tesla Cybertruck outside the Trump hotel in Las Vegas used generative AI including ChatGPT to plan the attack, Las Vegas police said...",Finnhub,finnhub_news
139,102,2025,1,7,2025-01-07 17:31:00,"Tesla Inc. stock falls Tuesday, underperforms market","Tesla Inc. stock falls Tuesday, underperforms market",MarketWatch,finnhub_news
140,103,2025,1,7,2025-01-07 16:37:00,U.S. Adds Tencent and Tesla Supplier to Its Chinese Military List. Why ‘Pandora’s Box’ Has Opened for Chinese Stocks.,U.S. Adds Tencent and Tesla Supplier to Its Chinese Military List. Why ‘Pandora’s Box’ Has Opened for Chinese Stocks.,MarketWatch,finnhub_news
141,104,2025,1,7,2025-01-07 16:00:00,Wall Street Lunch: Aurora Partners With Continental And Nvidia,Aurora (AUR) is jumping after announcing a long-term strategic partnership with auto supplier Continental (CTTAF) and Nvidia.,SeekingAlpha,finnhub_news
