,index,year,month,day,publishedAt,headline,summary,source,API
142,105,2025,1,7,2025-01-07 14:37:45,US opens probe into 2.6 million Teslas over remote driving,"STORY: The U.S. has opened an investigation into 2.6 million Tesla vehicles over reports of crashes involving a remote driving feature called Actually Smart Summon. The feature, which...",Finnhub,finnhub_news
143,106,2025,1,7,2025-01-07 13:52:22,Big Tech ETF drops sharply in stock-market selloff as Treasury yields rise,Big Tech ETF drops sharply in stock-market selloff as Treasury yields rise,MarketWatch,finnhub_news
144,107,2025,1,7,2025-01-07 13:41:06,"US opens another Tesla probe, latest focused on tech that remotely returns car to driver",NEW YORK — U.S. regulators have opening an investigation into 2.6 million Tesla after reports of crashes involving the use of company technology that allows drivers to remotely command their...,Finnhub,finnhub_news
145,108,2025,1,7,2025-01-07 13:32:39,Are ‘Magnificent Seven’ bonds now worth buying after months-long selloff?,Are ‘Magnificent Seven’ bonds now worth buying after months-long selloff?,MarketWatch,finnhub_news
146,109,2025,1,7,2025-01-07 13:05:05,"Elon Musk helped Trump win. Now he's looking at Europe, and many politicians are alarmed","LONDON — Fresh from pouring his money and energies into helping Donald Trump win re-election, Elon Musk has trained his sights on Europe, setting off alarm bells among politicians across the...",Finnhub,finnhub_news
147,110,2025,1,7,2025-01-07 13:00:34,On The Hunt For Magnificent Earnings Growth? Check These 7 Stocks.,On The Hunt For Magnificent Earnings Growth? Check These 7 Stocks.,DowJones,finnhub_news
148,111,2025,1,7,2025-01-07 12:54:39,EV Company News For The Month Of December 2024,"Our December 2024 edition of the roundup of Electric Vehicle [EV] company news, including Tesla, BYD, and Geely. Read on at Seeking Alpha.",SeekingAlpha,finnhub_news
149,112,2025,1,7,2025-01-07 12:30:00,Vertiv: Nvidia Isn't The Only AI Game Changer (Upgrade),"Vertivâs solutions are vital for AI clusters and data centers. See why VRT stock offers growth potential at a reasonable PEG ratio, like Nvidia.",SeekingAlpha,finnhub_news
150,113,2025,1,7,2025-01-07 12:11:00,"Tesla faces more risk than its stock reflects, prompting a downgrade","Tesla faces more risk than its stock reflects, prompting a downgrade",MarketWatch,finnhub_news
151,114,2025,1,7,2025-01-07 11:48:20,Tesla: share price falls after BofA downgrade,"On Tuesday, Tesla posted one of the steepest declines on the Nasdaq 100 index, as Bank of America lowered its recommendation on the stock from buy to neutral.About an hour after opening, the electric...",Finnhub,finnhub_news
152,80,2025,1,7,2025-01-07 11:30:00,These EV ‘Battery Belt’ Towns Are Betting Trump Won’t Ditch Them,"Ford, Hyundai and other carmakers are cranking up new EV battery factories, while uncertainty looms over Biden-era subsidies for them.",Yahoo,finnhub_news
153,115,2025,1,7,2025-01-07 11:20:00,ClearBridge Large Cap Growth Strategy Q4 2024 Commentary,"In a period of momentum-driven returns and bullish investor sentiment sparked by the re-election of Donald Trump, the more defensively positioned Strategy underperformed.",SeekingAlpha,finnhub_news
154,116,2025,1,7,2025-01-07 11:02:28,Dow Jones Rises After Jobs Data; Nvidia Reverses From Record Highs,Dow Jones Rises After Jobs Data; Nvidia Reverses From Record Highs,DowJones,finnhub_news
155,117,2025,1,7,2025-01-07 11:00:00,Avalanche leads way as most big cryptocurrencies post drops,Avalanche leads way as most big cryptocurrencies post drops,MarketWatch,finnhub_news
156,118,2025,1,7,2025-01-07 10:30:00,"2025 Analyst Outlook: Chris Lau On Tariffs, Global Worries, EVs, And An AI Bubble",Tariffs could top macroeconomic concerns to start 2025. Read what sectors could surface as potential winners in the year ahead.,SeekingAlpha,finnhub_news
157,119,2025,1,7,2025-01-07 10:14:00,Cathie Wood’s ARK Innovation ETF Couldn’t Keep Up in 2024. What Did—and Didn’t—Work.,Cathie Wood’s ARK Innovation ETF Couldn’t Keep Up in 2024. What Did—and Didn’t—Work.,MarketWatch,finnhub_news
158,120,2025,1,7,2025-01-07 10:12:00,Elon Musk Isn’t the First. The Long History of Presidents Employing Business Leaders.,Elon Musk Isn’t the First. The Long History of Presidents Employing Business Leaders.,MarketWatch,finnhub_news
159,121,2025,1,7,2025-01-07 09:52:55,Tesla seeks Sweden court order in protracted labour union conflict,"Tesla has asked a court in Sweden to ensure that the country's Transport Agency provides access to licence plates that are currently blocked by postal workers in a wider labour conflict, a court...",Finnhub,finnhub_news
160,122,2025,1,7,2025-01-07 09:30:00,Rivian: Don't Let The Short-Lived Hype Fool You,"A stunning 25% one-day surge helped Rivian recover substantial losses over the past one year, placating the RIVN bagholders. Explore more details here.",SeekingAlpha,finnhub_news
161,123,2025,1,7,2025-01-07 09:25:00,"The More It Drops, The More I Buy","The stock market just suffered a dip, and I am buying it. Find out the 3 purchases we recently made to take advantage of the dip.",SeekingAlpha,finnhub_news
162,124,2025,1,7,2025-01-07 08:31:00,Tesla: Irrelevance Of Valuation Ratios And The Future Of Robotaxis And Humanoids,"Tesla's risks include a selloff following FY24 earnings, especially if 2025 EV sales guidance is lowered. See why I rate TSLA stock a strong buy.",SeekingAlpha,finnhub_news
163,125,2025,1,7,2025-01-07 07:55:10,"Stellantis, Toyota, Ford, Mazda, Subaru plan to pool CO2 emissions with Tesla","Stellantis, Toyota, Ford, Mazda and Subaru are planning to pool carbon emissions with U.S. EV maker Tesla to comply with European Union 2025 rules, an EU filing showed on Tuesday. If not...",Finnhub,finnhub_news
164,126,2025,1,7,2025-01-07 07:05:36,US self-driving car companies seek boost under Trump,A group representing self-driving car companies on Tuesday called on the U.S. government to do more to speed the deployment of autonomous vehicles and remove barriers to adoption. The...,Finnhub,finnhub_news
165,127,2025,1,7,2025-01-07 06:26:41,US traffic safety regulator opens probe into about 2.6 million Tesla vehicles,"The U.S. National Highway Traffic Safety Administration said on Tuesday it has opened a probe into about 2.6 million Tesla vehicles over issues related to the EV maker's feature dubbed, Actually Smart...",Finnhub,finnhub_news
166,128,2025,1,7,2025-01-07 05:42:57,Top 3 takeaways from Nvidia's CES 2025 keynote,Nvidia announced a host of new software and hardware technologies at CES 2025. Here are the three most important debuts.,Yahoo,finnhub_news
167,129,2025,1,7,2025-01-07 05:16:54,Tesla supplier Panasonic Energy: cutting China supply 'No.1 objective' for U.S,"LAS VEGAS (Reuters) -Tesla supplier Panasonic Energy plans to eliminate its supply-chain dependence on China for electric vehicle batteries made in the United States, a senior executive told Reuters, calling the shift a ""No.1 objective"".  The comments from Allan Swan, President of Panasonic Energy of North America, highlight how incoming President Donald Trump's pledge to raise tariff imports on Chinese goods has forced companies around the world to reassess their manufacturing processes.",Yahoo,finnhub_news
168,130,2025,1,7,2025-01-07 03:00:00,Can Boeing Be Fixed? Aerospace Leaders Offer a Repair Manual,"Restore trust, revamp the design process and forget the stock price: Experts from inside and outside the company share advice for the troubled jet maker.",Yahoo,finnhub_news
169,0,2025,1,7,2025-01-07 00:00:00,[Removed],[Removed],[Removed],api_news_org
170,99,2025,1,7,2025-01-07 00:00:00,Tesla is being investigated by the feds over its A.S.S. technology,"The National Highway Transportation Safety Administration (NHTSA) has opened a new investigation into Elon Musk’s Tesla (TSLA), this time over its Actually Smart Summon (A.S.S.)Read more...",Quartz India,api_news_org
171,87,2025,1,7,2025-01-07 00:00:00,"BYD a cartonné sur la voiture électrique en 2024, et est à deux doigts de dépasser Tesla","Avec 1 764 992 voitures électriques vendues dans le monde en 2024, BYD a fait largement mieux qu'en 2023. Porté par son marché intérieur, le constructeur chinois n'est désormais qu'à quelques milliers d'exemplaires de dépasser Tesla.",Frandroid,api_news_org
172,33,2025,1,7,2025-01-07 00:00:00,This Slim Little Battery I Saw at CES 2025 Is Like a Tesla Powerwall for Your Fridge,"You don't need an electrician to install BioLite's backup battery system, which can keep at least a few of your appliances on when the power goes out -- like your refrigerator.",CNET,api_news_org
173,15,2025,1,7,2025-01-07 00:00:00,"Automakers to pool CO2 emissions with Tesla, Polestar to meet EU 2025 rules",,Yahoo Entertainment,api_news_org
174,58,2025,1,7,2025-01-07 00:00:00,Elon Musk: Wie lange geht das für Tesla noch gut?,Elon Musk konzentriert sich derzeit auf die Politik. Bei Tesla setzt er allein auf Zukunftsversprechen. Nun mehren sich die Anzeichen einer Krise.,Die Zeit,api_news_org
175,47,2025,1,7,2025-01-07 00:00:00,Tesla Full Self Driving Computer Failures Are Bricking Cars And Disabling Features,"The computer that enables Tesla to claim that its vehicles have “full-self driving” capability is having some pretty serious issues right now. The computers are failing, and it’s nearly bricking some owner’s Tesla’s. Read more...",Jalopnik,api_news_org
176,39,2025,1,7,2025-01-07 00:00:00,Les batteries des premiers Cybertruck discrètement remplacées par Tesla ?,"Contactés par Tesla pour des ""problèmes mineurs"" à régler sur leur Cybertruck, certains propriétaires ont finalement vu la batterie de leur pick-up être remplacée par le constructeur.",Presse-citron,api_news_org
177,131,2025,1,6,2025-01-06 23:49:29,Dow Jones Futures: Nvidia Surges Above Buy Point; Jensen Huang CES Speech In Focus,Dow Jones Futures: Nvidia Surges Above Buy Point; Jensen Huang CES Speech In Focus,DowJones,finnhub_news
178,132,2025,1,6,2025-01-06 23:45:21,Tesla (TSLA) Ascends But Remains Behind Market: Some Facts to Note,"In the closing of the recent trading day, Tesla (TSLA) stood at $411.05, denoting a +0.15% change from the preceding trading day.",Yahoo,finnhub_news
179,133,2025,1,6,2025-01-06 23:44:46,Tesla Stock Price Levels to Watch After Volatile Stretch,Tesla shares have gained ground the past two sessions after a five-day losing streak during which the stock lost 18% of its value. Monitor these important chart levels.,Yahoo,finnhub_news
180,134,2025,1,6,2025-01-06 22:02:53,Tesla's stock valuation appears 'discounted': Analyst explains,"President-elect Donald Trump's proposed tariff policy has raised investor concerns about its potential impact on industries, including electric vehicles (EVs), particularly for companies like Tesla (TSLA). Stifel NextGen transport analyst Stephen Gengaro joins Market Domination to share his perspective on the EV maker amid tariff uncertainties. Gengaro suggests that Trump's proposed tariff policy would have ""wide-ranging"" effects, including reduced competition in US markets — a development that could be ""theoretically a positive"" for Tesla. However, he cautions that the company may face challenges with its international supply chain for parts sourced outside the US. The analyst emphasizes that Tesla is ""more than a car company,"" pointing to initiatives like full self-driving (FSD) technology as ""a huge value driver"" for the stock in the ""medium-to-long term."" He suggests that the potential of these ventures makes the current stock valuation appear ""discounted."" Looking ahead to the Trump administration, Gengaro anticipates more favorable regulations that could accelerate Tesla's initiatives. ""As far as Musk betting on Trump, I think he's clearly engaged in the conversation as far as getting regulation accelerated on the FSD side,"" he explains. ""And that sort of opens the door for just various growth opportunities for the company over time."" To watch more expert insights and analysis on the latest market action, check out more Market Domination here. This post was written by Angel Smith",Yahoo,finnhub_news
181,135,2025,1,6,2025-01-06 17:39:13,"AppLovin, Nvidia, Tesla, Broadcom, and Meta Lead Nasdaq's Tech Surge in 2024","Nvidia stock rose 180% in 2024, fueled by demand for AI chips and new software offerings.",Yahoo,finnhub_news
182,136,2025,1,6,2025-01-06 17:31:31,"15 Minutes Into 2025, Elon Musk Was Done With Social Security Tax. Meanwhile, 94% Of Americans Take The Entire Year","The tax system often feels unequal and Social Security is an obvious example. According to economics professor Teresa Ghilarducci, by the time most people celebrated the New Year, Elon Musk had already paid his Social Security taxes for all of 2025. Just 15 minutes into the year, his obligation was complete and he paid all his Social Security tax on his earnings from Tesla. If all of Musk's income were taxed, he could have paid his Social Security tax for the whole year in just about one minute.",Yahoo,finnhub_news
183,137,2025,1,6,2025-01-06 17:31:00,"Tesla Inc. stock rises Monday, still underperforms market","Tesla Inc. stock rises Monday, still underperforms market",MarketWatch,finnhub_news
184,138,2025,1,6,2025-01-06 16:41:05,"Salesforce, Workday, Tesla, American Airlines: Top analyst calls","Seana Smith and Brad Smith examine the top analyst calls of the day, focusing on Salesforce (CRM), Workday (WDAY), Tesla (TSLA), and American Airlines (AAL). Guggenheim analysts downgrade Salesforce to Sell, citing challenges monetizing artificial intelligence and lack of innovation. They also upgrade Workday to Neutral, saying the company may be done with revenue reductions. JPMorgan reiterates its Underweight rating for Tesla based on the company's fourth quarter delivery miss and the potential removal of subsidies. On the other end of the spectrum, American Air gets three separate upgrades to Buy based partially on above-industry unit revenue growth. To watch more expert insights and analysis on the latest market action, check out more Morning Brief here. This post was written by Naomi Buchanan.",Yahoo,finnhub_news
185,139,2025,1,6,2025-01-06 16:40:07,Tesla: Stock Surges Like Bitcoin Amid Deteriorating Fundamentals,"Financial writer analyzes Tesla, Inc.'s performance, citing issues with declining deliveries, inflated valuation, and lack of growth. Click for this TSLA update.",SeekingAlpha,finnhub_news
186,140,2025,1,6,2025-01-06 15:32:05,"Tesla upgraded, ServiceTitan initiated: Wall Street's top analyst calls","Tesla upgraded, ServiceTitan initiated: Wall Street's top analyst calls",Yahoo,finnhub_news
187,141,2025,1,6,2025-01-06 15:20:00,"Uber, Lyft Stocks Are Buys for ‘25, Analysts Say. Don’t Worry About Tesla and Alphabet.","Uber, Lyft Stocks Are Buys for ‘25, Analysts Say. Don’t Worry About Tesla and Alphabet.",MarketWatch,finnhub_news
188,142,2025,1,6,2025-01-06 15:11:25,"How To Read This Market As Nvidia, Meta Rise, But Tesla Skids","How To Read This Market As Nvidia, Meta Rise, But Tesla Skids",DowJones,finnhub_news
189,143,2025,1,6,2025-01-06 14:47:01,Tesla Stock Today: This Bull Put Spread Offers A $125 Booty Right Now,Tesla Stock Today: This Bull Put Spread Offers A $125 Booty Right Now,DowJones,finnhub_news
190,144,2025,1,6,2025-01-06 14:00:00,"Can ""Magnificent Seven"" ETFs Retain Their Glory in 2025?","The ""Magnificent 7"" stocks are likely to see slower earnings growth and price appreciation in 2025, but their dominance will be undeniable.",Yahoo,finnhub_news
191,145,2025,1,6,2025-01-06 13:53:18,Tesla registers annual vehicle delivery drop in 2024,"In 2024, the firm reported production of 1,773,443 vehicles and deliveries of 1,789,226 units.",Yahoo,finnhub_news
192,146,2025,1,6,2025-01-06 13:19:57,Tesla's Deliveries Disappoint: Time To Take Profits (Rating Downgrade),"Tesla, Inc.'s stock is extremely overvalued despite disappointing vehicle deliveries, making it a risky investment at current all-time highs. Explore more details here.",SeekingAlpha,finnhub_news
193,147,2025,1,6,2025-01-06 13:02:17,Big Tech ETF rallies as Nvidia posts big gain,Big Tech ETF rallies as Nvidia posts big gain,MarketWatch,finnhub_news
194,148,2025,1,6,2025-01-06 13:01:18,Tesla faces increasing challenges: is the EV giant losing its edge?,"Copyright © BusinessAMBE 2023Key takeawaysCompetition from Chinese manufacturers and traditional automakers has increased.Tesla urgently needs to address declining deliveries, plummeting share...",Finnhub,finnhub_news
195,149,2025,1,6,2025-01-06 11:40:00,Super Micro Stock Jumps Again. It’s Starting the Year With Some Wild Swings.,Super Micro Stock Jumps Again. It’s Starting the Year With Some Wild Swings.,MarketWatch,finnhub_news
196,150,2025,1,6,2025-01-06 11:04:34,"Tesla: stock rises, New Street sees catalysts","Tesla posted a second consecutive session of strong gains on Monday morning on the New York Stock Exchange, buoyed by a recommendation upgrade from New Street Research.In a note, the independent...",Finnhub,finnhub_news
197,151,2025,1,6,2025-01-06 10:55:15,The AI Bull Market Will Continue In 2025,"AI and chip innovation create a virtuous cycle. Read why Big Tech, including Nvidia and AMD, are poised to lead in AI infrastructure investments.",SeekingAlpha,finnhub_news
198,152,2025,1,6,2025-01-06 10:51:25,Dow Jones Rises; Nvidia Hits Buy Point Ahead Of CEO Jensen Huang Speech,Dow Jones Rises; Nvidia Hits Buy Point Ahead Of CEO Jensen Huang Speech,DowJones,finnhub_news
199,153,2025,1,6,2025-01-06 10:38:00,Tesla Stock Rises. Selling Cars Is Now Less Important Than This.,"Investors wiped out all of Thursday’s losses with a big Friday gain, showing that current sales numbers aren’t what’s driving the stock.",Yahoo,finnhub_news
200,154,2025,1,6,2025-01-06 10:08:14,Tesla: My Top Long Idea For 2025,"Tesla's valuation is justified by its advanced tech and diversified ecosystem, making it a top pick for 2025 with growth potential. Read my update on TSLA.",SeekingAlpha,finnhub_news
201,155,2025,1,6,2025-01-06 09:40:00,FTSE 100 LIVE: London markets lower as UK business confidence dips to two-year low,"Tax rises and falling sales are worrying UK businesses, according to new data.",Yahoo,finnhub_news
202,156,2025,1,6,2025-01-06 09:30:00,Car Giant Run-Down: A Mixed Bag,"Tesla struggles with market share, GM and Ford show growth, Rivian faces financial challenges. Read more to see my thoughts.",SeekingAlpha,finnhub_news
203,157,2025,1,6,2025-01-06 09:18:32,Dow Jones Futures Rise On Trump Tariff Plans; Nvidia Breaks Out With CEO Jensen Huang Due,Dow Jones Futures Rise On Trump Tariff Plans; Nvidia Breaks Out With CEO Jensen Huang Due,DowJones,finnhub_news
204,158,2025,1,6,2025-01-06 06:16:00,How Uber and Lyft Are Gearing Up for the Robotaxi Revolution,"After ending their own driverless plans, the ride-sharing companies are embracing autonomous-vehicle operators and offering new app features.",Yahoo,finnhub_news
205,159,2025,1,6,2025-01-06 03:18:19,"Seasonal Patterns Didn't Work In 2024, How Does That Affect 2025?","Seasonal patterns in 2024 didn't conform as expected, but I will continue to use them as signposts for trading and hedging in 2025. Read more here.",SeekingAlpha,finnhub_news
206,23,2025,1,6,2025-01-06 00:00:00,No hace falta esperar al Tesla Bot: este aspirador de Roborock incluye un brazo robótico para limpiar y manipular objetos,"Estamos en enero de 2025, y eso significa que es hora de vivir en primera persona el CES 2025, la feria tecnológica que suele ser el epicentro de muchas innovaciones curiosas. No todo es ordenadores, televisores y coches. El hogar inteligente también es prota…",Xataka.com,api_news_org
207,40,2025,1,6,2025-01-06 00:00:00,Les futures Tesla équipées des mêmes batteries que chez… BMW ?,"Le chinois EVE Energy, déjà associé de BMW, aurait récemment signé un accord avec un ""client américain"".",Presse-citron,api_news_org
208,18,2025,1,6,2025-01-06 00:00:00,"Ford, Tesla, GEM among nearly 400,000 vehicles recalled: Check car recalls here",,Yahoo Entertainment,api_news_org
209,160,2025,1,5,2025-01-05 18:35:15,"Elon Musk Nearly Sold Struggling Tesla To Google For $6 Billion – But When He 'No Longer Needed A Savior,' The Deal Was Called Off","According to a November Quartz article, Tesla is now worth more than GM, Ford, Toyota and almost every other car company combined. Hard to believe, right? Especially when you consider that back in 2013, Tesla was so broke that Elon Musk came close to selling it to Google. The deal? A tidy $6 billion up-front plus $5 billion for factory expansions. But in true Musk fashion, he pulled the plug at the last second – not out of arrogance but because Tesla's fortunes reversed practically overnight. Do",Yahoo,finnhub_news
210,161,2025,1,5,2025-01-05 15:43:00,We Tested Tesla’s Newest Self-Driving Software. This Is the Surprise.,How much progress the company makes toward making its cars truly self-driving will be critical to how the stock performs this year.,Yahoo,finnhub_news
211,162,2025,1,5,2025-01-05 15:17:31,"Is Tesla, Inc. (NASDAQ:TSLA) the Hottest Large-Cap Stock Right Now?","We recently compiled a list of the 10 Hottest Large-Cap Stocks Right Now. In this article, we are going to take a look at where Tesla, Inc. (NASDAQ:TSLA) stands against the other large-cap stocks. This article will analyze several prominent large-cap stocks that are currently exerting significant influence on market dynamics. These stocks are currently considered […]",Yahoo,finnhub_news
212,163,2025,1,5,2025-01-05 13:44:49,SoFi Technologies: Wall Street Vs Retail Investors,"Financial writer delves into the contrasting views on SoFi, a battleground stock disliked by analysts but beloved by retail investors.",SeekingAlpha,finnhub_news
213,164,2025,1,5,2025-01-05 12:00:00,Why A Major Market Reversal Is Likely Coming In 2025,Discover why a major market reversal may be on the horizon in 2025 and how one financial writer is adjusting their investments accordingly.,SeekingAlpha,finnhub_news
214,165,2025,1,5,2025-01-05 11:47:00,Prediction: This Artificial Intelligence (AI) Stock Will Drop Out of the $1 Trillion Club in 2025,"Tesla (NASDAQ: TSLA) stock rose by 70% during 2024, catapulting the company to a market capitalization of more than $1 trillion.  Tesla CEO Elon Musk put his cash and influence behind the Trump campaign, and investors are speculating the company will benefit from lighter regulations under the incoming administration, which might help fast-track its artificial intelligence-powered full self-driving (FSD) technology.  FSD has the potential to transform Tesla's economics, but the company faces a serious challenge in the shorter term.",Yahoo,finnhub_news
215,166,2025,1,5,2025-01-05 11:30:00,How Donald Trump’s Tech Picks Orbit Elon Musk,The people set to shape tech policy in Trump’s administration have embraced Musk and joined in bashing big social-media firms.,Yahoo,finnhub_news
216,167,2025,1,5,2025-01-05 11:30:00,Forklifts Hurt Thousands of Workers Each Year. Factories Are Seeking Alternatives.,"The vehicles have been integral to factories and warehouses for more than a century, but now companies are aspiring to go “forklift-free” to improve productivity and safety.  Retail orders for forklifts dropped 28% in 2023, the biggest annual decline in 14 years.  Plastic-pipe manufacturer Ipex designed its new factory in North Carolina to minimize the use of forklifts, relying instead on overhead cranes and hand-pushed electric pallet jacks.",Yahoo,finnhub_news
217,168,2025,1,5,2025-01-05 09:50:00,"2 AI Robotics Stocks to Buy Before They Soar 185% and 315%, According to Wall Street Experts","Jensen Huang is the CEO of Nvidia (NASDAQ: NVDA), a company whose chips power the vast majority of artificial intelligence (AI) systems.  Elon Musk, CEO of Tesla (NASDAQ: TSLA), made a related prediction last year: ""I think by 2040, probably there are more humanoid robots than there are people.""  With that in mind, Citigroup analysts estimate humanoid robot sales will hit $14 billion by 2030, $1.1 trillion by 2040, and $7 trillion by 2050.",Yahoo,finnhub_news
218,169,2025,1,5,2025-01-05 07:19:56,Rivian: My Best Investment Idea For 2025,The $6.6 billion DOE loan and new plant plans could boost Rivian's production capacity by 400K vehicles annually by 2028. Read why RIVN stock is a Buy.,SeekingAlpha,finnhub_news
219,170,2025,1,5,2025-01-05 05:33:59,7 Investments To Avoid In 2024: The Reckoning,"At the beginning of this year, I wrote an article about which stocks to avoid in 2024. Check out how well I did with my predictions versus S&P 500.",SeekingAlpha,finnhub_news
220,70,2025,1,5,2025-01-05 00:00:00,La fin d’une ère dorée pour Tesla,"2024, l'année de la première baisse des ventes, avec une concurrence toujours plus acharnée et un CEO plus clivant que jamais. Est-ce que 2025 marquera un tournant pour Tesla ? Je me permets d’en douter. Voici pourquoi.",Frandroid,api_news_org
221,38,2025,1,5,2025-01-05 00:00:00,Tesla : coup de frein après des années à fond les manettes,"Pour la première fois depuis plus d’une décennie, le constructeur de voitures électriques doit composer avec une baisse de ses ventes.",Journal du geek,api_news_org
222,62,2025,1,5,2025-01-05 00:00:00,El gran desacoplamiento: el vehículo eléctrico y las ventas de Tesla,"Las noticias sobre la caída en ventas de Tesla, la primera vez que la marca reporta un descenso de las ventas anuales frente al año anterior, han querido ser interpretadas por muchos como un supuesto punto de inflexión en el crecimiento del vehículo eléctrico…",Enriquedans.com,api_news_org
