,index,year,month,day,publishedAt,headline,summary,source,API
223,171,2025,1,4,2025-01-04 23:47:21,Three Reasons Why I’m Bullish on UBER Stock in 2025,"Uber (UBER) shares have had a rough ride in 2024, lagging behind the broader market with only a 12% gain over the last 12 months. However, my bullish outlook remains intact, considering that recent underperformance doesn’t reflect any weakness in the company’s business fundamentals. The company has been posting solid revenue and profit growth while generating impressive cash flow. The main factor weighing on investor sentiment seems to be the fear that robotaxis could disrupt the ride-sharing in",Yahoo,finnhub_news
224,172,2025,1,4,2025-01-04 22:52:35,Why Tesla Stock Jumped in December While EV Charging Stocks Tanked,"Tesla (NASDAQ: TSLA) CEO Elon Musk bet on Donald Trump winning the November election, and investors jumped on the Tesla bandwagon after discovering he bet right.  The election results helped drive Tesla shares sharply higher to end the year.  ChargePoint Holdings (NYSE: CHPT) and EVgo (NASDAQ: EVGO) shares slid 12.3% and 37.8%, respectively.",Yahoo,finnhub_news
225,173,2025,1,4,2025-01-04 22:38:48,"Tesla: High Hopes, Low Deliveries","Teslaâs 2024 has been underwhelming, with sales growth stalling at less than 1% and operating income declining by 9%. Read why TSLA stock is a Sell.",SeekingAlpha,finnhub_news
226,174,2025,1,4,2025-01-04 19:35:58,Tesla Vs. BYD: Tesla Deliveries Fall In 2024; Rival Seizes BEV Crown,"Tesla deliveries fell for 2024, missing Q4 views. BYD's sales continue to surge, seizing the BEV crown. But TSLA stock remains strong.",Yahoo,finnhub_news
227,175,2025,1,4,2025-01-04 16:22:00,1 Wall Street Analyst Just Raised Tesla Stock's Price Target by Over $100. Is It a Buy?,"Tesla (NASDAQ: TSLA) stock had a banner year in 2024.  Many investors surmised that CEO Elon Musk's position as a Donald Trump advisor will benefit both the company and its shareholders.  Tesla disappointed investors with its fourth-quarter delivery report this week, though, as it delivered fewer EVs than expected and didn't quite match 2023's total.",Yahoo,finnhub_news
228,176,2025,1,4,2025-01-04 15:00:00,"Spirit Airlines' worth, Tesla's miss, and drug hikes: Business news roundup","Spirit Airlines, which filed for bankruptcy in November, has given investors a peek into its ongoing reorganization. As part of that process, it filed a financial update with the Securities and Exchange Commission that shows its equity is worth less than the compensation paid to its executives in 2023.",Yahoo,finnhub_news
229,177,2025,1,4,2025-01-04 13:55:22,Tesla price target raised to $275 from $195 at Evercore ISI,"Evercore ISI analyst Chris McNally raised the firm’s price target on Tesla (TSLA) to $275 from $195 and keeps an In Line rating on the shares. Consistent with the firm’s valuation approach of a “Tale of 2 TSLAs,” where it assigns one multiple to “core” industrial revenue for things “they make/sell now” and then backs into a market implied “call option” bucket, the firm increased the size of the “call option implied basket” to about $900B from $600B and the implied market probability of success t",Yahoo,finnhub_news
230,178,2025,1,4,2025-01-04 13:30:21,Tesla price target lowered to $351 from $360 at Truist,"Truist analyst William Stein lowered the firm’s price target on Tesla (TSLA) to $351 from $360 and keeps a Hold rating on the shares. The firm cites the company’s Q4 delivery and production figures coming in below consensus estimates and its own projections while also reflecting inventory burn with a lower production figure, the analyst tells investors in a research note. Truist’s pricing data also suggests that average sales prices for Tesla were down 0.5% sequentially, and the firm believes th",Yahoo,finnhub_news
231,179,2025,1,4,2025-01-04 12:00:21,Investors Will Want Tesla's (NASDAQ:TSLA) Growth In ROCE To Persist,"If you're not sure where to start when looking for the next multi-bagger, there are a few key trends you should keep an...",Yahoo,finnhub_news
232,180,2025,1,4,2025-01-04 10:06:00,Tesla Has a Problem That Trump Can't Fix. Is It a Red Flag for Investors?,"In fact, he could make it worse.",Yahoo,finnhub_news
233,181,2025,1,4,2025-01-04 08:38:14,BYD: Impressive Performance And Good Prospects (Rating Upgrade),BYD Company defied EV sector weakness in 2024 with strong fundamentals & market multiples indicating it's not overvalued.,SeekingAlpha,finnhub_news
234,182,2025,1,4,2025-01-04 07:49:24,Tesla Stock Jumps 8% as Free Supercharging for Life Makes a Comeback,Tesla Revives Free Supercharging to Boost Slumping Model S Sales,Yahoo,finnhub_news
235,183,2025,1,4,2025-01-04 03:00:00,"In Two Attacks, a Pair of Unraveling Lives and Remaining Mysteries",New Orleans and Las Vegas grapple with the aftermath of deadly incidents; suicide note is recovered from exploded Tesla.,Yahoo,finnhub_news
236,184,2025,1,4,2025-01-04 01:05:12,Why Dogecoin Is Soaring Today,"Dogecoin (CRYPTO: DOGE) has posted big gains over the last day of trading.  The crypto market has seen bullish momentum over the last day of trading, but there's also a major coin-specific catalyst for Dogecoin's gains.  Investors are betting that X's new payments system will be launching soon and that Dogecoin could be incorporated into the platform.",Yahoo,finnhub_news
237,185,2025,1,4,2025-01-04 01:00:00,"Green Beret in Tesla Explosion Suffered From PTSD, Authorities Say",Investigators recovered writings on Matthew Alan Livelsberger’s phone that aired concerns about the direction of the U.S.,Yahoo,finnhub_news
238,186,2025,1,4,2025-01-04 00:57:00,Cybertruck Explosion: Green Beret Called Blast a ‘Wake Up Call’,"Las Vegas police used DNA to confirm that the body found in the Tesla Cybertruck after its explosion was Matthew Livelsberger, an active U.S. servicemember.",Yahoo,finnhub_news
239,187,2025,1,4,2025-01-04 00:57:00,Musk’s Mystery Gift: $112 Million in Tesla Stock to Unnamed Charities,"The transaction was part of Musk’s year-end tax planning. The recipients “have no current intention to sell” the shares, the Securities and Exchange Commission filing said.",Yahoo,finnhub_news
240,1,2025,1,4,2025-01-04 00:00:00,"Tesla May Be in a Sales Slump, but EVs Are Doing OK Overall",Purchase data shows that electric vehicle sales are growing globally. But the question remains: How fast?,Wired,api_news_org
241,20,2025,1,4,2025-01-04 00:00:00,PR experts say Elon Musk’s handling of the Tesla Cybertruck explosion in Las Vegas was a masterclass,Las Vegas Sheriff Kevin McMahill thanked Musk Wednesday for providing the authorities with information to aid the investigation.,Yahoo Entertainment,api_news_org
242,31,2025,1,4,2025-01-04 00:00:00,'I feel like Batman': What Tesla driver texted his ex-girlfriend before explosion outside Trump Hotel,,Yahoo Entertainment,api_news_org
243,189,2025,1,3,2025-01-03 22:53:05,S&P 500 Gains and Losses Today: Index Jumps as Supermicro and Tesla Bounce Back,"The S&P 500 added 1.3% on Friday, Jan. 3, ending a streak of five straight down days as stocks looked to regain their momentum to start the new trading year.",Yahoo,finnhub_news
244,190,2025,1,3,2025-01-03 22:29:07,"Canaccord boosts Tesla price target, calls 2025 'year of the robot'","Canaccord Genuity raised its price target on Tesla (TSLA) to $404 per share from $298, citing optimism over the company’s growth, including in its energy business and possible robotics venture. Market Domination hosts Josh Lipton and Josh Schafer note the firm remains bullish despite facing challenges and risks, such as potential EV tax credit reductions in the US and sluggish Full Self-Driving take rates. To watch more expert insights and analysis on the latest market action, check out more Market Domination here. This post was written by Josh Lynch",Yahoo,finnhub_news
245,191,2025,1,3,2025-01-03 22:19:00,"These Stocks Moved the Most Today: Tesla, U.S. Steel, Rivian, Nvidia, Carvana, Vistra, BUD, and More","Tesla stock rises after shares of the electric-vehicle maker tumbled following weaker-than-expected deliveries, Rivian surges as deliveries top estimates, and U.S. Steel declines as President Biden blocks the sale of the company to Japan’s Nippon Steel.",Yahoo,finnhub_news
246,192,2025,1,3,2025-01-03 22:16:00,"The Score: Boeing, Tesla, U.S. Steel and More Stocks That Defined the Week","A passenger plane in South Korea crashed on Dec. 29, killing nearly all of the 181 people on board, in one of the deadliest aviation disasters in recent years.  The U.S. National Transportation Safety Board said it was leading a team of American investigators—including representatives from the U.S. Federal Aviation Administration and  Boeing  —to assist South Korea’s officials in their probe.  The Boeing 737-800 suffered an apparent bird strike as it approached Muan International Airport, attempted to land at a high rate of speed without its landing gear down, slid off the runway and slammed into a concrete barrier.",Yahoo,finnhub_news
247,193,2025,1,3,2025-01-03 22:15:00,Tesla Stock Jumped After Analyst Price Target Increase. So Much for the Bear Market.,The shares dropped more than 6% to start a new year of trading after the company reported weaker-than-expected fourth-quarter deliveries.,Yahoo,finnhub_news
248,194,2025,1,3,2025-01-03 21:29:13,Why Tesla Stock Is Surging Today,"Tesla (NASDAQ: TSLA) stock is seeing strong bullish momentum in Friday's trading.  The electric vehicle (EV) company's share price was up 6.9% as of 3:15 p.m. ET amid the backdrop of a 1.2% gain for the S&P 500 index and a 1.7% gain for the Nasdaq Composite index.  In addition to bullish momentum for the broader market today, Tesla is gaining ground thanks to positive industry reports and analyst coverage.",Yahoo,finnhub_news
249,188,2025,1,3,2025-01-03 20:54:00,What Car Sales Can Tell Us About the U.S. Auto Market Right Now,"Demand for pickup trucks and hybrid vehicles helped automakers increase deliveries, but challenges loom for 2025.",Yahoo,finnhub_news
250,195,2025,1,3,2025-01-03 20:17:00,"Ford, GM Grew EV Sales Faster Than Tesla. What It Means for the Stocks.","Tesla  fourth-quarter sales didn’t live up to lofty expectations.  Ford Motor and General Motors on Friday reported their year-end U.S. delivery figures.  Ford stock was up 2.4% in afternoon trading, while the  and  were up 1.3% and 0.8%, respectively.",Yahoo,finnhub_news
251,196,2025,1,3,2025-01-03 19:41:44,"Consumer Discretionary, Technology Push US Equity Indexes Higher",US equity indexes rose midday Friday as consumer discretionary and technology topped sector charts w,Yahoo,finnhub_news
252,197,2025,1,3,2025-01-03 19:38:00,"Tesla trades more on 'tectonic' narratives, headlines: RBC analyst","Rivian (RIVN) shares surged by over 13% Friday morning — at the time of this video's posting in the afternoon, shares are currently up by over 22% — after beating fourth quarter EV delivery estimates: posting nearly 14,200 EVs during the fourth quarter and delivering nearly 51,580 electric trucks in 2024. On the other hand, Tesla (TSLA) saw a decline in its annual EV sales for the first time in over a decade. RBC Capital Markets Global Autos Analyst Tom Narayan joins the Morning Brief team to weigh in on the two electric automakers' recent performances. ""I think it's both of those may be overanalyzed a little too much,"" Narayan tells Brad Smith and Madison Mills. ""For the Rivian one, we knew the company told us that Q4 was going to be stronger than Q3, they had a supply issue in Q3. The Q4 delivery number was actually consistent with their guidance."" Narayan explains that while Tesla came out below consensus estimates, its EV delivery results were ""still a solid number,"" noting the company to have gotten a boost this past quarter amid conversations around the future of its full self-driving (FSD) capabilities. To watch more expert insights and analysis on the latest market action, check out more Morning Brief here. This post was written by Josh Lynch",Yahoo,finnhub_news
253,198,2025,1,3,2025-01-03 19:10:08,Pop Goes The Tesla (Our Top Short For 2025),"Tesla announced its first YoY decline in vehicle sales, of just over 1%, well below 30-40% growth goals. Click here to find out why TSLA stock is a Strong Sell.",SeekingAlpha,finnhub_news
254,199,2025,1,3,2025-01-03 18:51:00,Tesla Stock Rises After Analyst Price Target Increase. So Much for the Bear Market.,The shares dropped more than 6% to start a new year of trading after the company reported weaker-than-expected fourth-quarter deliveries.,Yahoo,finnhub_news
255,200,2025,1,3,2025-01-03 18:43:00,"GM, Ford, Toyota Post U.S. Sales Gains in 2024",Demand for pickup trucks and hybrid vehicles helps automakers increase deliveries; challenges loom for ‘25.,Yahoo,finnhub_news
256,201,2025,1,3,2025-01-03 18:39:04,Rivian stock surges to start the year on better-than-expected EV deliveries,Rivian stock soared Friday after the electric truck maker reported better than expected vehicle sales for its quarter ending Dec. 31.,Yahoo,finnhub_news
257,202,2025,1,3,2025-01-03 18:34:42,Here's Why Lucid Stock Rose Again Today,"Shares of Lucid Group (NASDAQ: LCID) are rising sharply today.  While the electric vehicle (EV) maker hasn't yet released its own fourth-quarter production and delivery figures, data from its peers is giving investors reason to be optimistic.  Investors spent much of 2024 worrying that consumer demand for EVs was dropping.",Yahoo,finnhub_news
258,204,2025,1,3,2025-01-03 18:14:14,Why Tesla (TSLA) May Need To Stop Selling Cars To Hit $10k Per Share,"Wild price targets on Tesla stock aren’t uncommon. But no matter how ridiculous a price target some analysts set, the stock races up to reach it. A similar occurrence was observed when Alexandra Merz, CEO of L&F Services, came out with a price target of $10,000 on the stock! Strangely enough, this involves a scenario […]",Yahoo,finnhub_news
259,205,2025,1,3,2025-01-03 17:59:00,"Ford, GM Outgrew Tesla EV Sales. The Stocks Are Up.","Tesla  fourth-quarter sales didn’t live up to lofty expectations.  Ford Motor  and  General Motors  on Friday reported their year-end U.S. delivery figures.  Ford stock was up 0.7% in midday trading, while the  and  were up 0.7% and 0.5%, respectively.",Yahoo,finnhub_news
260,206,2025,1,3,2025-01-03 17:50:40,"FBI says suspect in Cybertruck blast had no animosity towards Trump, had PTSD",The FBI said on Friday that the suspect in the Tesla Cybertruck that exploded outside the Trump International Hotel in Las Vegas had no animosity towards President-elect Donald Trump and likely had...,Finnhub,finnhub_news
261,207,2025,1,3,2025-01-03 17:50:35,"Top Stock Movers Now: Tesla, Vistra, US Steel, and More","U.S. equities were higher at midday Friday, bouncing back from yesterday's selloff on optimism about growing demand for nuclear power and Tesla's recovery from its dip.",Yahoo,finnhub_news
262,208,2025,1,3,2025-01-03 17:43:50,Soldier who died in Las Vegas explosion left note saying it was to be a wakeup for country's ills,"A soldier who died in an explosion of a Tesla Cybertruck at the Trump hotel in Las Vegas left a note saying it was stunt to serve as “wakeup call” for the country’s ills, investigators said...",Finnhub,finnhub_news
263,209,2025,1,3,2025-01-03 17:40:05,GM vs. TSLA: Which Stock Should Value Investors Buy Now?,GM vs. TSLA: Which Stock Is the Better Value Option?,Yahoo,finnhub_news
264,210,2025,1,3,2025-01-03 17:39:26,"Ford EV sales surge by 38% in 2024, Q4 sales up 9%","Ford (F) shares tick up after reporting fourth quarter sales to have increased 9% year-over-year while US electric vehicle sales surged by 38% for the year. Catalysts host Madison Mills highlights Ford's latest sales figures after Tesla (TSLA) missed its own quarterly delivery estimates. To watch more expert insights and analysis on the latest market action, check out more Catalysts here. This post was written by Josh Lynch",Yahoo,finnhub_news
265,211,2025,1,3,2025-01-03 17:14:55,Stock Market Today: Indexes Close Near Session Highs As Nasdaq Rallies 1.8% (Live Coverage),Stock Market Today: Indexes Close Near Session Highs As Nasdaq Rallies 1.8% (Live Coverage),DowJones,finnhub_news
266,212,2025,1,3,2025-01-03 17:06:15,"EV Sales, Including Hybrids, Surge For Auto Giants Not Named Tesla","EV Sales, Including Hybrids, Surge For Auto Giants Not Named Tesla",DowJones,finnhub_news
267,213,2025,1,3,2025-01-03 17:00:00,Tesla Slips on Q4 Delivery Miss: ETFs in Focus,Tesla misses estimates for Q4 deliveries and sees the first year-over-year decline in deliveries for 2024.,Yahoo,finnhub_news
268,214,2025,1,3,2025-01-03 16:50:00,Pre-Markets in the Green on Last Day of the Week,Pre-Markets in the Green on Last Day of the Week,Yahoo,finnhub_news
269,215,2025,1,3,2025-01-03 16:41:39,"Nvidia stock jumps, leads 'Magnificent 7' gains to start 2025 after end-of-year tech sell-off",Nvidia stock led the so-called “Magnificent 7” tech stocks higher to start the year after a group-wide selloff in the last days of 2024.,Yahoo,finnhub_news
270,216,2025,1,3,2025-01-03 16:21:31,"Rivian (RIVN) Surges on Deliveries Beat, Positive News on Production Outlook","Rivian (RIVN) stock is rallying 19% this morning after the electric-vehicle maker reported that its fourth-quarter deliveries had exceeded the Street’s average estimate. Moreover, the automaker noted that a shortage of a part was no longer limiting its production capacity. Rivian’s higher-than-expected Q4 deliveries contrast favorably with those of Tesla (TSLA). Yesterday Elon Musk’s automaker […]",Yahoo,finnhub_news
271,217,2025,1,3,2025-01-03 16:21:00,Quiet Pre-Market Friday Ahead of Big Jobs Week,"Job gains over the past two months have been volatile, but the Unemployment Rate has remained fairly steady.",Yahoo,finnhub_news
272,218,2025,1,3,2025-01-03 16:07:00,Tesla Stock Is in a Bear Market. This Analyst Just Raised His Price Target.,The shares dropped more than 6% to start a new year of trading after the company reported weaker-than-expected fourth-quarter deliveries.,Yahoo,finnhub_news
273,219,2025,1,3,2025-01-03 15:28:05,Questions remain about soldier's motive in Cybertruck explosion outside Trump's Las Vegas hotel,Investigators know that a highly decorated Army soldier shot himself in the head inside a Tesla Cybertruck packed with fireworks just before it exploded outside Trump International Hotel in Las Vegas...,Finnhub,finnhub_news
274,220,2025,1,3,2025-01-03 14:58:06,New Orleans attack and Vegas explosion highlight extremist violence by active military and veterans,"While much remains unknown about the man who carried out an attack in New Orleans on New Year’s and another who died in an explosion in Las Vegas the same day, the violence highlights the increased...",Finnhub,finnhub_news
275,221,2025,1,3,2025-01-03 14:55:00,TSLA vs. BYDDY: The Fierce Battle for 2025 EV Dominance,"BYD's rapid ascent challenges Tesla's reign as the EV leader, but with Tesla's innovation and loyal following, the 2025 showdown for EV supremacy is heating up.",Yahoo,finnhub_news
276,222,2025,1,3,2025-01-03 14:41:00,Tesla's 2024 Delivery Miss: How Should You Approach TSLA Stock Now?,"TSLA's 2024 delivery miss has certainly sparked short-term bearishness, but the company's long-term growth story remains intact.",Yahoo,finnhub_news
277,223,2025,1,3,2025-01-03 14:17:44,Why Analysts Are Divided on Tesla Stock After Lackluster Q4 Deliveries Data,"Tesla shares have fallen 18% in a five trading session losing streak, capped by a 6% decline Thursday following disappointing fourth-quarter production and delivery numbers that has led some analysts to affirm their views on the electric vehicle maker.",Yahoo,finnhub_news
278,224,2025,1,3,2025-01-03 14:08:54,EV maker Rivian beats expectations for deliveries as supply snag eases,STORY: Shares of electric vehicle maker Rivian surged more than 20% Friday morning after it surpassed analysts' expectations for fourth-quarter deliveries and said its production was no longer...,Finnhub,finnhub_news
279,225,2025,1,3,2025-01-03 14:07:00,The 1 Tech Stock That’s Actually a Bargain,"A new entrant in the Big Tech club of stocks means it’s time for a new name to describe tech’s largest companies.  What was once FANG, and then FAANG, FAMANG, and most recently Magnificent Seven, is now best labeled as BATMMAAN.  The new group consists of  Broadcom Apple Tesla Microsoft Meta Platforms Alphabet Amazon  and  Nvidia  All of them carry market values above $1 trillion.",Yahoo,finnhub_news
280,226,2025,1,3,2025-01-03 14:00:28,"Tesla's big year, what’s next for Musk: Opening Bid","Month after month, Tesla (TSLA) continues to be one of Yahoo Finance’s top most active tickers. And as a big car lover, it’s no surprise that Yahoo Finance Executive Editor Brian Sozzi had to spend an entire Opening Bid episode focusing on our top Tesla conversations from the year. With critical investment insights, competitive landscape analysis, and absolute fangirl hype, this episode is chock-full of diverse Tesla commentary. You’ll hear from L&F Investor Services CEO Alexandra Merz, Gerber Kawasaki Wealth and Investment Management co-founder and president Ross Gerber, and Bank Of America Securities senior automotive analyst John Murphy. For full episodes of Opening Bid, listen on your favorite podcast platform or watch on our website. This post was written by Rachael Lewis-Krisky, producer for Opening Bid.",Yahoo,finnhub_news
281,227,2025,1,3,2025-01-03 13:48:22,5 Things to Know Before the Stock Market Opens,"News of the day for Jan. 3, 2025",Yahoo,finnhub_news
282,228,2025,1,3,2025-01-03 13:40:21,Tesla vs. BYD: The High-Stakes Battle for Global EV Supremacy Heats Up,China's booming EV market tips the scales as Tesla fights to keep its crown against BYD's relentless rise.,Yahoo,finnhub_news
283,229,2025,1,3,2025-01-03 12:01:08,Tesla's 2024 sales drop due to Cybertruck delay and fierce competition,"Copyright © BusinessAMBE 2023Key takeawaysTesla delivered 495,570 vehicles in the fourth quarter, a record but less than forecast by analysts.The company's total annual sales of nearly 1.8...",Finnhub,finnhub_news
284,203,2025,1,3,2025-01-03 11:38:00,"These Stocks Are Moving the Most Today: Tesla, U.S. Steel, Nvidia, Apple, Vistra, and More","Tesla stock rises after shares of the electric-vehicle maker tumbled following weaker-than-expected deliveries, while reports say President Biden plans to block the sale of U.S. Steel to Japan’s Nippon Steel.",Yahoo,finnhub_news
285,230,2025,1,3,2025-01-03 11:24:01,Tesla: Major Q4 Delivery Disappointment,Tesla's Q4 delivery miss and potential threats from Trump's EV policy could impact TSLA's premium valuation in 2025. See why I'm going to keep my sell rating.,SeekingAlpha,finnhub_news
286,231,2025,1,3,2025-01-03 11:00:00,Where to Invest Your Money in 2025,Where to Invest Your Money in 2025,DowJones,finnhub_news
287,232,2025,1,3,2025-01-03 10:56:10,Tesla: on the rebound with broker's comments,"After falling 6% on Thursday on the back of weaker-than-expected deliveries in the fourth quarter of 2024, Tesla regained 2% in early trading on Wall Street, while Canaccord Genuity maintained its...",Finnhub,finnhub_news
288,233,2025,1,3,2025-01-03 09:04:07,Tesla: price target raised at Canaccord,"Canaccord Genuity reaffirms its 'buy' recommendation on Tesla, with a price target raised from $298 to $404, despite the electric carmaker's recent announcement of weaker-than-expected deliveries.This...",Finnhub,finnhub_news
289,234,2025,1,3,2025-01-03 09:00:00,VONG: Time To Take Some Gains,"Vanguard Russell 1000 Growth Index Fund ETF holds 394 large- and mid-cap stocks, heavily concentrated in technology and top holdings. Explore more details here.",SeekingAlpha,finnhub_news
290,235,2025,1,3,2025-01-03 07:08:28,"North American Morning Briefing : Tesla, Chip -2-",09:30/UK: Dec Narrow money and reserve balances 13:30/US: U.S. Weekly Export Sales 15:00/US: Dec ISM Report On Business Manufacturing PMI 15:00/US: Nov Metropolitan Area Employment and...,Finnhub,finnhub_news
291,236,2025,1,3,2025-01-03 07:07:04,Consumers boosted 2024 U.S. new-car sales to five-year high,"U.S. new-car sales in 2024 continued to rise from their pandemic lows, bolstered by replenished inventories and higher incentives, analysts estimated. Sales are expected to top 15.8...",Finnhub,finnhub_news
292,237,2025,1,3,2025-01-03 06:22:12,Tesla's China Sales Continued to Fall in December,"By Jiahui Huang Tesla's China sales fell in December as local automakers continued to squeeze its market share. The U.S. electric-vehicle maker sold 93,766 China-made cars in December, 0.4%...",Finnhub,finnhub_news
293,238,2025,1,3,2025-01-03 04:56:11,"Tesla China sales hit record high, bucking global decline","STORY: Tesla sales hit a record in China in 2024. They rose 8.8% to over 657,000 vehicles during the year, and were up even more in December. Friday's news comes a day...",Finnhub,finnhub_news
294,239,2025,1,3,2025-01-03 03:49:23,"Tesla's China sales rise to record high of 83,000 in December","Tesla's electric vehicle sales in the world's largest auto market increased in December by 12.8% from a month earlier to a record high of 83,000 units, according to Tesla China. The U.S. automaker's EV sales in China also logged their best year in 2024 with a 8.8% rise to 657,000 units.",Yahoo,finnhub_news
295,240,2025,1,3,2025-01-03 03:00:00,How Elon Musk Made the Las Vegas Bombing About His ‘Badass Truck’,The confusing hours after the Tesla vehicle was apparently used as a makeshift bomb would be any brand’s reputational nightmare.,Yahoo,finnhub_news
